{
  "npub": "npub1ds30lhxws60mmp8xru258vfakr2sqtn3etszwu9s95k0t8vkx9lsfqwjg9",
  "role": "advocate",
  "status": "active",
  "member_since": "2026-03-30",
  "display_name": "Tollbooth Shortlinks",
  "services": [
    {
      "name": "tollbooth-shortlinks",
      "url": "https://tollbooth-shortlinks.fastmcp.app/mcp",
      "description": "Community utility — ephemeral, human-friendly short URLs for OAuth flows and long URLs. 24-hour TTL, no tracking, no interstitials."
    }
  ],
  "upstream_authority_npub": "npub1l94pd4qu4eszrl6ek032ftcnsu3tt9a7xvq2zp7eaxeklp6mrpzssmq8pf",
  "notes": "Registered as community utility Advocate via Oracle"
}
