{
  "npub": "npub1qchpfnuw76gjmg6y9w4e5yaj9xcq97ft6rd49mj4j0vrsdrkujpqzl7tz0",
  "role": "operator",
  "status": "active",
  "member_since": "2026-05-23",
  "display_name": "optionality-mcp",
  "services": [
    {
      "name": "optionality-mcp",
      "url": "https://optionality-mcp.fastmcp.app/mcp",
      "description": "An AI-judged options-trading drill: the Firm composes an opportunity, you pitch a trade, and a judge model scores it on five dimensions with a Facts Ledger."
    }
  ],
  "upstream_authority_npub": "npub157hmysd6sw7m8kkldycnnc74mssxp9nweddk2p5sw9l2nktr950qyxrenn",
  "notes": "Registered via Authority-mediated operator registration protocol"
}
