{
  "npub": "npub19gqrkwsssnz5dl6mj54memy65g4lq7qu7efu532nma3p8c6yzugse3f7a2",
  "role": "operator",
  "status": "active",
  "member_since": "2026-03-01",
  "display_name": "Excalibur MCP",
  "services": [
    {
      "name": "Excalibur MCP",
      "url": "https://excalibur-mcp.fastmcp.app/mcp",
      "description": "Posting to X and Nostr for AI agents: scheduled posts, live dynamic blocks resolved at send time, and post performance."
    }
  ],
  "upstream_authority_npub": "npub1fuhq0clgzhhkuhywe8c5c5hdnnkzlhedesy6e35x2aucz6xy9c6s6mhv7z",
  "notes": "Excalibur MCP Server — Social media operator"
}
