{
  "npub": "npub125zw84dlssyme5dddy4ck5tfqatsd5f7pvyn54ewmlmzrs3758dqghjypu",
  "role": "advocate",
  "status": "active",
  "member_since": "2026-03-10",
  "display_name": "OAuth2 Authorization Code Collector",
  "services": [
    {
      "name": "tollbooth-oauth2-collector",
      "url": "https://tollbooth-oauth2-collector.fastmcp.app/mcp",
      "description": "Holds OAuth2 authorization codes, sealed to the operator that asked, until that operator's MCP collects them once."
    },
    {
      "name": "tollbooth-oauth2-callback",
      "url": "https://tollbooth-dpyc-oauth.val.run",
      "description": "The browser callback OAuth providers redirect to. It turns their GET redirect into the POST an MCP takes and hands the code to the collector.",
      "transport": "http"
    }
  ],
  "upstream_authority_npub": "npub1l94pd4qu4eszrl6ek032ftcnsu3tt9a7xvq2zp7eaxeklp6mrpzssmq8pf",
  "notes": "Registered as community utility Advocate via Oracle"
}
