{
  "npub": "npub1xdv5j2tf769s20wh3a0dj4hn6pms9vp7awnnd3fde8ata8fak7pqwg09av",
  "role": "operator",
  "status": "active",
  "member_since": "2026-06-17",
  "display_name": "Cypher MCP",
  "services": [
    {
      "name": "cypher-mcp",
      "url": "https://cypher-mcp.fastmcp.app/mcp",
      "description": "Monetized graph answers: operator-authored, parameterized Cypher queries over a Neo4j graph, each sold as a named, priced answer."
    }
  ],
  "upstream_authority_npub": "npub1zummm5awn88kw2hz6deeyjprpw0fzuv9rvzrxf3vu453yyqzvdss49xd2t",
  "notes": "Registered via Authority-mediated operator registration protocol"
}
