{
  "npub": "npub1jgy3m3wg0xu2vkfvff0stt9vae789qfd9k03wzqhl5aakasmy2dqw7w48f",
  "role": "operator",
  "status": "active",
  "member_since": "2026-09-23",
  "display_name": "ChartRemotely MCP",
  "services": [
    {
      "name": "ChartRemotely MCP",
      "url": "https://chartremotely-mcp.fastmcp.app/mcp",
      "description": "Puts a security on your own desktop trading chart from anywhere, by voice or tool call, through a small agent on your Mac, and sends back a snapshot of what it shows."
    }
  ],
  "upstream_authority_npub": "npub157hmysd6sw7m8kkldycnnc74mssxp9nweddk2p5sw9l2nktr950qyxrenn",
  "notes": "Registered via Authority-mediated operator registration protocol"
}
