{
  "npub": "npub1vt9hpckkqvtkuxffrh7kun8vsvsl8rwjr0lfc9utgpdr3u7c5tcqv33g0y",
  "role": "operator",
  "status": "active",
  "member_since": "2026-03-25",
  "display_name": "Tollbooth Sample",
  "services": [
    {
      "name": "Tollbooth Sample",
      "url": "https://tollbooth-sample.fastmcp.app/mcp",
      "description": "Weather statistics from Open-Meteo, served by the reference Tollbooth DPYC™ operator that new MCP servers are built from."
    }
  ],
  "upstream_authority_npub": "npub1fuhq0clgzhhkuhywe8c5c5hdnnkzlhedesy6e35x2aucz6xy9c6s6mhv7z",
  "notes": "Registered via Authority-mediated operator registration protocol"
}
