{
  "npub": "npub14rkuqcl50cm7x507jhp3ryk7lghyucxwrjlrgaj6mlznhqh776hqws5gre",
  "role": "operator",
  "status": "active",
  "member_since": "2026-08-30",
  "display_name": "GoodEarth MCP",
  "services": [
    {
      "name": "GoodEarth MCP",
      "url": "https://goodearth-mcp.fastmcp.app/mcp",
      "description": "Climate analytics for small specialty-crop and flower farms: frost, heat, rain, daylight and planting windows, read for each plot you farm."
    }
  ],
  "upstream_authority_npub": "npub157hmysd6sw7m8kkldycnnc74mssxp9nweddk2p5sw9l2nktr950qyxrenn",
  "notes": "Registered via Authority-mediated operator registration protocol"
}
