{
  "npub": "npub1ajcnwx8l4kd89x7qquv33dhc4u5cdr2r35qfq4mgqh9r3alp8gtqfs46u0",
  "role": "operator",
  "status": "inactive",
  "member_since": "2026-07-02",
  "display_name": "Tollbooth Fermyon",
  "services": [
    {
      "name": "tollbooth-fermyon",
      "url": "https://lonnies-mini.tailee8e94.ts.net/mcp",
      "description": "Weather stats Operator on Spin/WASI — the edge port of tollbooth-sample, hosted by the tollbooth-wasmcp SpinOperatorHost. Full DPYC toolset (proof, Secure Courier, Lightning) running in WebAssembly."
    }
  ],
  "upstream_authority_npub": "npub157hmysd6sw7m8kkldycnnc74mssxp9nweddk2p5sw9l2nktr950qyxrenn",
  "notes": "Registered via Authority-mediated operator registration protocol. Spin/WASI implementation (tollbooth-wasmcp host); same operator source as tollbooth-sample. URL is the Tailscale funnel during development; intended production endpoint is https://fermyon.tollbooth-dpyc.com/mcp once the Akamai deploy is live."
}
