{
  "npub": "npub15e3ver3pskqsuqzszrp9mxpks7tqg7kedzyhmxfwlmu2jf8enaas86ll75",
  "role": "operator",
  "status": "active",
  "member_since": "2026-03-11",
  "display_name": "Schwab MCP",
  "services": [
    {
      "name": "schwab-mcp",
      "url": "https://schwab-mcp.fastmcp.app/mcp",
      "description": "Charles Schwab brokerage data for AI agents: quotes, option chains, price history, positions, balances and order history from your own Schwab account."
    }
  ],
  "upstream_authority_npub": "npub1fuhq0clgzhhkuhywe8c5c5hdnnkzlhedesy6e35x2aucz6xy9c6s6mhv7z",
  "notes": "Schwab MCP Server — brokerage data operator"
}
