{
  "npub": "npub1d999638gqpn8c594teklxtxva0uvxdng80q3ycyqvldjdl457c7qcrq64z",
  "role": "citizen",
  "status": "active",
  "member_since": "2026-03-02",
  "display_name": "Lonnie VanZandt (Twitter)",
  "services": [],
  "upstream_authority_npub": "npub1l94pd4qu4eszrl6ek032ftcnsu3tt9a7xvq2zp7eaxeklp6mrpzssmq8pf",
  "notes": "Personal Twitter identity — Schnorr signature verified"
}
