{
  "npub": "npub1ue5pfah2c3z65h2kpkzxheajfh3y53l6rq9zhnth8v80uq5tressz0hpey",
  "role": "operator",
  "status": "active",
  "member_since": "2026-08-11",
  "display_name": "Roastify MCP",
  "services": [
    {
      "name": "Roastify MCP",
      "url": "https://roastify-mcp.fastmcp.app/mcp",
      "description": "The Roastify coffee catalog and packaging artwork for merchants: products, blends and stock, with a private library of label designs to rebrand."
    }
  ],
  "upstream_authority_npub": "npub1zummm5awn88kw2hz6deeyjprpw0fzuv9rvzrxf3vu453yyqzvdss49xd2t",
  "notes": "Registered via Authority-mediated operator registration protocol"
}
