{
  "npub": "npub1sz60evcudpnaa9q9rmtnj9y4w6waz9vlt3p23hg82q3mlwu7y2xqem9rpl",
  "role": "operator",
  "status": "active",
  "member_since": "2026-04-05",
  "display_name": "TaxSort MCP",
  "services": [
    {
      "name": "taxsort-mcp",
      "url": "https://taxsort-mcp.fastmcp.app/mcp",
      "description": "Personal tax transaction storage: import bank and card CSVs, classify each line, and total them by IRS tax line, ready to share with a spouse."
    }
  ],
  "upstream_authority_npub": "npub1fuhq0clgzhhkuhywe8c5c5hdnnkzlhedesy6e35x2aucz6xy9c6s6mhv7z",
  "notes": "Registered via Authority-mediated operator registration protocol"
}
